{
  "version": "1.0.0",
  "asOf": "2026-10-09",
  "sources": [
    {
      "title": "Supreme Council of Universities (SCU) - Government universities",
      "url": "https://scu.eg/%d8%a7%d9%84%d8%ac%d8%a7%d9%85%d8%b9%d8%a7%d8%aa-%d8%a7%d9%84%d8%ad%d9%83%d9%88%d9%85%d9%8a%d8%a9/"
    },
    {
      "title": "Supreme Council of Universities (SCU) - Egyptian national (ahleya) universities",
      "url": "https://scu.eg/%d8%a7%d9%84%d8%ac%d8%a7%d9%85%d8%b9%d8%a7%d8%aa-%d8%a7%d9%84%d9%85%d8%b5%d8%b1%d9%8a%d8%a9-%d8%a7%d9%84%d8%a3%d9%87%d9%84%d9%8a%d8%a9/"
    },
    {
      "title": "Supreme Council of Universities (SCU) - Government technological universities",
      "url": "https://scu.eg/government-technological-universities/"
    },
    {
      "title": "Supreme Council of Universities (SCU) - Branches of international universities",
      "url": "https://scu.eg/branches-of-international-universities/"
    },
    {
      "title": "Arabic Wikipedia - List of universities of Egypt (cites SCU / Ministry of Higher Education / presidential decrees)",
      "url": "https://ar.wikipedia.org/wiki/%D9%82%D8%A7%D8%A6%D9%85%D8%A9_%D8%AC%D8%A7%D9%85%D8%B9%D8%A7%D8%AA_%D9%85%D8%B5%D8%B1"
    },
    {
      "title": "English Wikipedia - List of universities in Egypt",
      "url": "https://en.wikipedia.org/wiki/List_of_universities_in_Egypt"
    }
  ],
  "universities": [
    {
      "id": "cairo-university",
      "name": {
        "en": "Cairo University",
        "ar": "جامعة القاهرة"
      },
      "type": "public",
      "governorate": "Giza",
      "city": "Giza",
      "website": "https://cu.edu.eg/",
      "established": 1908,
      "sourceUrl": "https://scu.eg/%d8%a7%d9%84%d8%ac%d8%a7%d9%85%d8%b9%d8%a7%d8%aa-%d8%a7%d9%84%d8%ad%d9%83%d9%88%d9%85%d9%8a%d8%a9/",
      "verifiedAt": "2026-10-09"
    },
    {
      "id": "alexandria-university",
      "name": {
        "en": "Alexandria University",
        "ar": "جامعة الإسكندرية"
      },
      "type": "public",
      "governorate": "Alexandria",
      "city": "Alexandria",
      "website": "https://alexu.edu.eg/",
      "established": null,
      "sourceUrl": "https://scu.eg/%d8%a7%d9%84%d8%ac%d8%a7%d9%85%d8%b9%d8%a7%d8%aa-%d8%a7%d9%84%d8%ad%d9%83%d9%88%d9%85%d9%8a%d8%a9/",
      "verifiedAt": "2026-10-09"
    },
    {
      "id": "ain-shams-university",
      "name": {
        "en": "Ain Shams University",
        "ar": "جامعة عين شمس"
      },
      "type": "public",
      "governorate": "Cairo",
      "city": "Cairo",
      "website": "https://www.asu.edu.eg/",
      "established": 1950,
      "sourceUrl": "https://scu.eg/%d8%a7%d9%84%d8%ac%d8%a7%d9%85%d8%b9%d8%a7%d8%aa-%d8%a7%d9%84%d8%ad%d9%83%d9%88%d9%85%d9%8a%d8%a9/",
      "verifiedAt": "2026-10-09"
    },
    {
      "id": "assiut-university",
      "name": {
        "en": "Assiut University",
        "ar": "جامعة أسيوط"
      },
      "type": "public",
      "governorate": "Assiut",
      "city": "Assiut",
      "website": "https://www.aun.edu.eg/",
      "established": 1957,
      "sourceUrl": "https://scu.eg/%d8%a7%d9%84%d8%ac%d8%a7%d9%85%d8%b9%d8%a7%d8%aa-%d8%a7%d9%84%d8%ad%d9%83%d9%88%d9%85%d9%8a%d8%a9/",
      "verifiedAt": "2026-10-09"
    },
    {
      "id": "tanta-university",
      "name": {
        "en": "Tanta University",
        "ar": "جامعة طنطا"
      },
      "type": "public",
      "governorate": "Gharbia",
      "city": "Tanta",
      "website": "https://tanta.edu.eg/",
      "established": 1972,
      "sourceUrl": "https://scu.eg/%d8%a7%d9%84%d8%ac%d8%a7%d9%85%d8%b9%d8%a7%d8%aa-%d8%a7%d9%84%d8%ad%d9%83%d9%88%d9%85%d9%8a%d8%a9/",
      "verifiedAt": "2026-10-09"
    },
    {
      "id": "mansoura-university",
      "name": {
        "en": "Mansoura University",
        "ar": "جامعة المنصورة"
      },
      "type": "public",
      "governorate": "Dakahlia",
      "city": "Mansoura",
      "website": "https://www.mans.edu.eg/",
      "established": 1972,
      "sourceUrl": "https://scu.eg/%d8%a7%d9%84%d8%ac%d8%a7%d9%85%d8%b9%d8%a7%d8%aa-%d8%a7%d9%84%d8%ad%d9%83%d9%88%d9%85%d9%8a%d8%a9/",
      "verifiedAt": "2026-10-09"
    },
    {
      "id": "zagazig-university",
      "name": {
        "en": "Zagazig University",
        "ar": "جامعة الزقازيق"
      },
      "type": "public",
      "governorate": "Sharqia",
      "city": "Zagazig",
      "website": "https://www.zu.edu.eg/",
      "established": 1974,
      "sourceUrl": "https://scu.eg/%d8%a7%d9%84%d8%ac%d8%a7%d9%85%d8%b9%d8%a7%d8%aa-%d8%a7%d9%84%d8%ad%d9%83%d9%88%d9%85%d9%8a%d8%a9/",
      "verifiedAt": "2026-10-09"
    },
    {
      "id": "capital-university",
      "name": {
        "en": "Capital University (formerly Helwan University)",
        "ar": "جامعة العاصمة (حلوان سابقاً)"
      },
      "type": "public",
      "governorate": "Cairo",
      "city": "Helwan",
      "website": "https://www.helwan.edu.eg/",
      "established": 1975,
      "sourceUrl": "https://scu.eg/%d8%a7%d9%84%d8%ac%d8%a7%d9%85%d8%b9%d8%a7%d8%aa-%d8%a7%d9%84%d8%ad%d9%83%d9%88%d9%85%d9%8a%d8%a9/",
      "verifiedAt": "2026-10-09"
    },
    {
      "id": "minia-university",
      "name": {
        "en": "Minia University",
        "ar": "جامعة المنيا"
      },
      "type": "public",
      "governorate": "Minya",
      "city": "Minya",
      "website": "https://www.minia.edu.eg/Minia/",
      "established": 1976,
      "sourceUrl": "https://scu.eg/%d8%a7%d9%84%d8%ac%d8%a7%d9%85%d8%b9%d8%a7%d8%aa-%d8%a7%d9%84%d8%ad%d9%83%d9%88%d9%85%d9%8a%d8%a9/",
      "verifiedAt": "2026-10-09"
    },
    {
      "id": "menoufia-university",
      "name": {
        "en": "Menoufia University",
        "ar": "جامعة المنوفية"
      },
      "type": "public",
      "governorate": "Menoufia",
      "city": "Shebin El Kom",
      "website": "https://www.menofia.edu.eg/",
      "established": 1976,
      "sourceUrl": "https://scu.eg/%d8%a7%d9%84%d8%ac%d8%a7%d9%85%d8%b9%d8%a7%d8%aa-%d8%a7%d9%84%d8%ad%d9%83%d9%88%d9%85%d9%8a%d8%a9/",
      "verifiedAt": "2026-10-09"
    },
    {
      "id": "suez-canal-university",
      "name": {
        "en": "Suez Canal University",
        "ar": "جامعة قناة السويس"
      },
      "type": "public",
      "governorate": "Ismailia",
      "city": "Ismailia",
      "website": "https://suez.edu.eg/",
      "established": null,
      "sourceUrl": "https://scu.eg/%d8%a7%d9%84%d8%ac%d8%a7%d9%85%d8%b9%d8%a7%d8%aa-%d8%a7%d9%84%d8%ad%d9%83%d9%88%d9%85%d9%8a%d8%a9/",
      "verifiedAt": "2026-10-09"
    },
    {
      "id": "qena-university",
      "name": {
        "en": "Qena University (formerly South Valley University)",
        "ar": "جامعة قنا (جنوب الوادي سابقاً)"
      },
      "type": "public",
      "governorate": "Qena",
      "city": "Qena",
      "website": "https://www.svu.edu.eg/",
      "established": null,
      "sourceUrl": "https://scu.eg/%d8%a7%d9%84%d8%ac%d8%a7%d9%85%d8%b9%d8%a7%d8%aa-%d8%a7%d9%84%d8%ad%d9%83%d9%88%d9%85%d9%8a%d8%a9/",
      "verifiedAt": "2026-10-09"
    },
    {
      "id": "benha-university",
      "name": {
        "en": "Benha University",
        "ar": "جامعة بنها"
      },
      "type": "public",
      "governorate": "Qalyubia",
      "city": "Benha",
      "website": "https://www.bu.edu.eg/",
      "established": 2005,
      "sourceUrl": "https://scu.eg/%d8%a7%d9%84%d8%ac%d8%a7%d9%85%d8%b9%d8%a7%d8%aa-%d8%a7%d9%84%d8%ad%d9%83%d9%88%d9%85%d9%8a%d8%a9/",
      "verifiedAt": "2026-10-09"
    },
    {
      "id": "fayoum-university",
      "name": {
        "en": "Fayoum University",
        "ar": "جامعة الفيوم"
      },
      "type": "public",
      "governorate": "Fayoum",
      "city": "Fayoum",
      "website": "https://www.fayoum.edu.eg/",
      "established": 2005,
      "sourceUrl": "https://scu.eg/%d8%a7%d9%84%d8%ac%d8%a7%d9%85%d8%b9%d8%a7%d8%aa-%d8%a7%d9%84%d8%ad%d9%83%d9%88%d9%85%d9%8a%d8%a9/",
      "verifiedAt": "2026-10-09"
    },
    {
      "id": "beni-suef-university",
      "name": {
        "en": "Beni-Suef University",
        "ar": "جامعة بني سويف"
      },
      "type": "public",
      "governorate": "Beni Suef",
      "city": "Beni Suef",
      "website": "https://www.bsu.edu.eg/",
      "established": 2005,
      "sourceUrl": "https://scu.eg/%d8%a7%d9%84%d8%ac%d8%a7%d9%85%d8%b9%d8%a7%d8%aa-%d8%a7%d9%84%d8%ad%d9%83%d9%88%d9%85%d9%8a%d8%a9/",
      "verifiedAt": "2026-10-09"
    },
    {
      "id": "kafrelsheikh-university",
      "name": {
        "en": "Kafrelsheikh University",
        "ar": "جامعة كفر الشيخ"
      },
      "type": "public",
      "governorate": "Kafr El Sheikh",
      "city": "Kafr El Sheikh",
      "website": "https://kfs.edu.eg/",
      "established": 2006,
      "sourceUrl": "https://scu.eg/%d8%a7%d9%84%d8%ac%d8%a7%d9%85%d8%b9%d8%a7%d8%aa-%d8%a7%d9%84%d8%ad%d9%83%d9%88%d9%85%d9%8a%d8%a9/",
      "verifiedAt": "2026-10-09"
    },
    {
      "id": "sohag-university",
      "name": {
        "en": "Sohag University",
        "ar": "جامعة سوهاج"
      },
      "type": "public",
      "governorate": "Sohag",
      "city": "Sohag",
      "website": "https://www.sohag-univ.edu.eg/",
      "established": 2006,
      "sourceUrl": "https://scu.eg/%d8%a7%d9%84%d8%ac%d8%a7%d9%85%d8%b9%d8%a7%d8%aa-%d8%a7%d9%84%d8%ad%d9%83%d9%88%d9%85%d9%8a%d8%a9/",
      "verifiedAt": "2026-10-09"
    },
    {
      "id": "port-said-university",
      "name": {
        "en": "Port Said University",
        "ar": "جامعة بورسعيد"
      },
      "type": "public",
      "governorate": "Port Said",
      "city": "Port Said",
      "website": "https://psu.edu.eg/",
      "established": 2010,
      "sourceUrl": "https://scu.eg/%d8%a7%d9%84%d8%ac%d8%a7%d9%85%d8%b9%d8%a7%d8%aa-%d8%a7%d9%84%d8%ad%d9%83%d9%88%d9%85%d9%8a%d8%a9/",
      "verifiedAt": "2026-10-09"
    },
    {
      "id": "damanhour-university",
      "name": {
        "en": "Damanhour University",
        "ar": "جامعة دمنهور"
      },
      "type": "public",
      "governorate": "Beheira",
      "city": "Damanhour",